{
  "schemaVersion": 1,
  "id": "3f2a9c1e-7b4d-4e0a-9d51-6c8b2a7e1f40",
  "type": "lead.created",
  "occurredAt": "2026-10-16T09:30:00.000Z",
  "source": {
    "site": "syncflow.agency",
    "locale": "en",
    "market": "us"
  },
  "payload": {
    "name": "Alex Morgan",
    "company": "Example Holdings",
    "email": "alex.morgan@example.com",
    "role": "principal",
    "projectType": "enterprise-platform",
    "budgetBand": "band-2",
    "timeline": "this-quarter",
    "message": "Group-wide order portal, integrated with our ERP."
  }
}
